{
  "$schema": "https://json-schema.org/draft/2020-12/schema",
  "$id": "skill-compass/eval-result",
  "title": "SkillCompass Evaluation Result",
  "description": "Complete evaluation result for a SKILL.md file across six dimensions",
  "type": "object",
  "required": ["skill_name", "skill_path", "skill_type", "scores", "overall_score", "verdict", "weakest_dimension", "recommendations", "metadata"],
  "properties": {
    "skill_name": { "type": "string" },
    "skill_path": { "type": "string" },
    "skill_type": { "type": "string", "enum": ["atom", "composite", "meta"] },
    "partial": {
      "type": "boolean",
      "description": "True when scope is not full (gate or target). Absent or false for full evaluations."
    },
    "evaluated_dimensions": {
      "type": "array",
      "items": { "type": "string", "enum": ["D1", "D2", "D3", "D4", "D5", "D6"] },
      "description": "List of dimensions actually evaluated. Present only when partial is true."
    },
    "scores": {
      "type": "object",
      "description": "All six dimensions required for full evaluation. For partial evaluations, only evaluated dimensions are present.",
      "properties": {
        "structure": {
          "type": "object",
          "required": ["score", "max", "details", "sub_scores", "issues"],
          "properties": {
            "score": { "type": "integer", "minimum": 0, "maximum": 10 },
            "max": { "type": "integer", "const": 10 },
            "details": { "type": "string" },
            "sub_scores": {
              "type": "object",
              "properties": {
                "frontmatter": { "type": "number", "minimum": 0, "maximum": 10 },
                "format": { "type": "number", "minimum": 0, "maximum": 10 },
                "declarations": { "type": "number", "minimum": 0, "maximum": 10 }
              }
            },
            "issues": {
              "type": "array",
              "items": {
                "type": "object",
                "required": ["category", "severity", "item"],
                "properties": {
                  "category": { "type": "string" },
                  "severity": { "type": "string", "enum": ["error", "warning", "info"] },
                  "item": { "type": "string" },
                  "location": { "type": "string" }
                }
              }
            },
            "metadata": { "type": "object" }
          }
        },
        "trigger": {
          "type": "object",
          "required": ["score", "max", "details", "sub_scores", "issues"],
          "properties": {
            "score": { "type": "integer", "minimum": 0, "maximum": 10 },
            "max": { "type": "integer", "const": 10 },
            "details": { "type": "string" },
            "trigger_type": { "type": "string", "enum": ["description", "command", "hook", "glob", "always-on"] },
            "sub_scores": { "type": "object" },
            "issues": { "type": "array", "items": { "type": "object" } },
            "metadata": { "type": "object" }
          }
        },
        "security": {
          "type": "object",
          "required": ["score", "max", "pass", "findings", "tools_used"],
          "properties": {
            "score": { "type": "integer", "minimum": 0, "maximum": 10 },
            "max": { "type": "integer", "const": 10 },
            "pass": { "type": "boolean" },
            "findings": {
              "type": "array",
              "items": {
                "type": "object",
                "required": ["check", "severity", "description", "source"],
                "properties": {
                  "check": { "type": "string" },
                  "severity": { "type": "string", "enum": ["critical", "high", "medium", "low"] },
                  "location": { "type": "string" },
                  "description": { "type": "string" },
                  "recommendation": { "type": "string" },
                  "source": { "type": "string" }
                }
              }
            },
            "tools_used": {
              "type": "array",
              "items": { "type": "string" }
            },
            "details": { "type": "string" },
            "metadata": { "type": "object" }
          }
        },
        "functional": {
          "type": "object",
          "required": ["score", "max", "details", "sub_scores", "issues"],
          "properties": {
            "score": { "type": "integer", "minimum": 0, "maximum": 10 },
            "max": { "type": "integer", "const": 10 },
            "tier": { "type": "string", "enum": ["A", "B", "C"] },
            "details": { "type": "string" },
            "sub_scores": {
              "type": "object",
              "properties": {
                "core_functionality": { "type": "number", "minimum": 0, "maximum": 10 },
                "edge_handling": { "type": "number", "minimum": 0, "maximum": 10 },
                "output_stability": { "type": "number", "minimum": 0, "maximum": 10 },
                "output_quality": { "type": "number", "minimum": 0, "maximum": 10 },
                "error_handling": { "type": "number", "minimum": 0, "maximum": 10 },
                "instruction_clarity": { "type": "number", "minimum": 0, "maximum": 10 }
              }
            },
            "issues": { "type": "array", "items": { "type": "object" } },
            "metadata": { "type": "object" }
          }
        },
        "comparative": {
          "type": "object",
          "required": ["score", "max", "details", "metadata"],
          "properties": {
            "score": { "type": "integer", "minimum": 0, "maximum": 10 },
            "max": { "type": "integer", "const": 10 },
            "delta": { "type": "number" },
            "details": { "type": "string" },
            "sub_scores": { "type": "object" },
            "issues": { "type": "array", "items": { "type": "object" } },
            "metadata": {
              "type": "object",
              "required": ["delta"],
              "properties": {
                "delta": { "type": "number" },
                "value_category": { "type": "string" },
                "scenarios": {
                  "type": "array",
                  "items": {
                    "type": "object",
                    "properties": {
                      "name": { "type": "string" },
                      "with_skill": { "type": "number" },
                      "without_skill": { "type": "number" },
                      "improvement": { "type": "number" }
                    }
                  }
                }
              }
            }
          }
        },
        "uniqueness": {
          "type": "object",
          "required": ["score", "max", "details"],
          "properties": {
            "score": { "type": "integer", "minimum": 0, "maximum": 10 },
            "max": { "type": "integer", "const": 10 },
            "details": { "type": "string" },
            "similar_skills": {
              "type": "array",
              "items": {
                "type": "object",
                "properties": {
                  "name": { "type": "string" },
                  "overlap_percentage": { "type": "number" }
                }
              }
            },
            "supersession_risk": { "type": "string", "enum": ["low", "medium", "high"] },
            "sub_scores": { "type": "object" },
            "issues": { "type": "array", "items": { "type": "object" } },
            "metadata": { "type": "object" }
          }
        }
      }
    },
    "overall_score": { "type": "integer", "minimum": 0, "maximum": 100 },
    "verdict": {
      "type": "string",
      "enum": ["PASS", "CAUTION", "FAIL", "PASS (partial)", "CAUTION (partial)", "FAIL (partial)"]
    },
    "weakest_dimension": {
      "type": ["string", "null"],
      "enum": ["structure", "trigger", "security", "functional", "comparative", "uniqueness", null],
      "description": "Lowest-scored dimension. Null when only gate scope evaluated."
    },
    "recommendations": {
      "type": "array",
      "items": { "type": "string" }
    },
    "action": {
      "type": ["object", "null"],
      "description": "Recommended next action based on verdict. Null for PASS verdict.",
      "properties": {
        "type": {
          "type": "string",
          "enum": ["evolve", "quick_fix", "rollback", "merge", "rebuild", "remove"]
        },
        "summary": {
          "type": "string",
          "description": "Human-readable one-line recommendation"
        },
        "command": {
          "type": ["string", "null"],
          "description": "Executable command (e.g., /eval-improve), or null for suggestion-only actions"
        },
        "executable": {
          "type": "boolean",
          "description": "True if SkillCompass can execute the action upon user confirmation"
        }
      }
    },
    "metadata": {
      "type": "object",
      "properties": {
        "evaluated_at": { "type": "string", "format": "date-time" },
        "evaluator_version": { "type": "string" },
        "feedback_applied": { "type": "boolean" }
      }
    }
  }
}
